{
  "$schema": "http://json-schema.org/draft-04/schema#",
  "id": "https://raw.githubusercontent.com/asclepias/event-model/master/jsonschema/event.json",
  "title": "Event message schema.",
  "description": "Schema of the event message.",
  "additionalProperties": false,
  "type": "object",
  "properties": {
    "ID": {
      "type": "string",
      "description": "Globally unique identifier of the event (UUID version 4 as specified in RFC 4122)."
    },
    "Description": {
      "type": "string",
      "description": "Free-text description of the event."
    },
    "EventType": {
      "type": "string",
      "description": "Type of the event. Controlled vocabulary: 'RelationshipCreated' or 'RelationshipDeleted'",
      "enum": ["RelationshipCreated", "RelationshipDeleted"]

    },
    "Time": {
      "type": "string",
      "description": "Time when the payload information was created."
    },
    "Creator": {
      "type": "string",
      "description": "Name of the party, which emmited this event."
    },
    "Source": {
      "type": "string",
      "description": "Name of the source, algorithm or procedure, which created this event."
    },
    "Payload": {
      "type": "array",
      "description": "Payload information specific to the EventType. An array, containing one or more payloads of the structure matching with the EventType.",
      "items": {
        "$ref": "scholix-v3.json"
      }
    }
  },
  "required": [
    "ID",
    "EventType",
    "Time",
    "Creator",
    "Source",
    "Payload"
  ]
}
